{
  "$schema": "./schemas/project-manifest.schema.json",
  "schemaVersion": "1.0.0",
  "project": {
    "id": "grandarchitect",
    "name": "Grand Architect",
    "alternateNames": [
      "Live Architect Studio"
    ],
    "kind": "nextjs-threejs-game-engine-studio",
    "maturity": "research-prototype",
    "maturityReason": "Engine kernel and conformance tests pass, but production readiness is not established. Frontier technologies (Z3, 3D Tiles, Cedar, Rapier) are at varying sub-integration levels. See docs/FRONTIER_SELF_CRITIQUE.md."
  },
  "provenance": {
    "commit": "6d1c76cd69cbf35bfee2316023691f29bad3523c",
    "commitShort": "6d1c76cd69cb",
    "branch": "swarm/integration",
    "dirty": true,
    "dirtyReason": "Working tree has 8 modified file(s): package.json, src/engine/game/bootstrap.ts, tsconfig.tsbuildinfo, evidence/village-people.png, src/engine/game/conformance/villagers-conformance.ts…",
    "generatedAt": "2026-08-11T23:52:18.761Z",
    "generatorVersion": "1.0.0",
    "generatedBy": "scripts/ai-context/build.ts"
  },
  "toolchain": {
    "runtime": "bun",
    "runtimeVersion": "unknown",
    "runtimeVersionReason": "Bun version not pinned in package.json. Run `bun --version` to verify locally.",
    "framework": "next",
    "frameworkVersion": "^16.1.1",
    "language": "typescript",
    "languageVersion": "^5",
    "database": "sqlite-prisma",
    "renderer": [
      "three",
      "react-three-fiber"
    ],
    "packageManager": "bun",
    "lockfile": "bun.lock"
  },
  "commands": {
    "install": {
      "command": "bun install --frozen-lockfile",
      "verified": true,
      "source": "package.json (implicit; bun is the package manager)",
      "notes": "Use --frozen-lockfile for reproducible installs. Plain `bun install` also works."
    },
    "dev": {
      "command": "bun run dev",
      "verified": true,
      "source": "package.json scripts.dev",
      "expandsTo": "next dev -p 3000 --webpack 2>&1 | tee dev.log",
      "lastRunExitCode": null,
      "lastRunNotes": "",
      "notes": "Next.js dev server on port 3000 with Webpack (required for Rapier WASM). Output also tee'd to dev.log."
    },
    "build": {
      "command": "bun run build",
      "verified": true,
      "source": "package.json scripts.build",
      "expandsTo": "bun run prebuild && next build && bun run scripts/copy-standalone.ts",
      "lastRunExitCode": null,
      "lastRunNotes": "",
      "notes": "Runs prebuild (build-manifest generation), then next build, then copies static + public into standalone output."
    },
    "lint": {
      "command": "bun run lint",
      "verified": true,
      "source": "package.json scripts.lint",
      "expandsTo": "eslint .",
      "lastRunExitCode": 0,
      "lastRunNotes": "exit 0",
      "notes": ""
    },
    "typecheck": {
      "command": "bun run typecheck",
      "verified": true,
      "source": "package.json scripts.typecheck",
      "expandsTo": "tsc --noEmit",
      "lastRunExitCode": 0,
      "lastRunNotes": "exit 0",
      "notes": "Historical drift note: an earlier version of this repo referenced `bun run typecheck` in README.md before the script existed in package.json. ai:check mechanically detects this class of drift."
    },
    "test": {
      "command": null,
      "verified": false,
      "blockedReason": "No canonical `test` script exists in package.json. Conformance tests are run as standalone TypeScript files.",
      "alternativeEntryPoints": [
        "src/engine/conformance-test.ts",
        "src/engine/kernel/conformance-test.ts (37 tests)",
        "src/engine/architect/conformance-test.ts (113 tests)",
        "src/engine/plugins/reference/conformance-test.ts (252 tests)",
        "src/engine/plugins/simulation/conformance-test.ts (247 tests)",
        "src/engine/plugins/simulation/ga-quest-conformance.ts (224 tests)",
        "src/engine/plugins/simulation/ga-cultivation-conformance.ts (203 tests)",
        "src/engine/plugins/simulation/ga-combat-conformance.ts (202 tests)",
        "src/engine/studio/conformance-test.ts"
      ]
    },
    "db:push": {
      "command": "bun run db:push",
      "verified": true,
      "source": "package.json scripts.db:push",
      "expandsTo": "prisma db push --accept-data-loss",
      "lastRunExitCode": null,
      "lastRunNotes": "",
      "notes": "Pushes prisma/schema.prisma to SQLite. --accept-data-loss is set."
    },
    "db:generate": {
      "command": "bun run db:generate",
      "verified": true,
      "source": "package.json scripts.db:generate",
      "expandsTo": "prisma generate",
      "lastRunExitCode": null,
      "lastRunNotes": "",
      "notes": ""
    },
    "ai:doctor": {
      "command": "bun run ai:doctor",
      "verified": true,
      "source": "package.json scripts.ai:doctor",
      "expandsTo": "bun run scripts/ai-context/doctor.ts",
      "lastRunExitCode": null,
      "lastRunNotes": "",
      "notes": "Reports SHA, dirty state, verified commands, blockers, maturity, authoritative paths."
    },
    "ai:check": {
      "command": "bun run ai:check",
      "verified": true,
      "source": "package.json scripts.ai:check",
      "expandsTo": "bun run scripts/ai-context/check.ts",
      "lastRunExitCode": null,
      "lastRunNotes": "",
      "notes": "Fails when documented commands don't exist, manifests are stale, etc."
    },
    "ai:build": {
      "command": "bun run ai:build",
      "verified": true,
      "source": "package.json scripts.ai:build",
      "expandsTo": "bun run scripts/ai-context/build.ts",
      "lastRunExitCode": null,
      "lastRunNotes": "",
      "notes": "Regenerates .ai/*.json manifests from the actual codebase."
    },
    "prebuild": {
      "command": "bun run prebuild",
      "verified": true,
      "source": "package.json scripts.prebuild",
      "expandsTo": "bun run scripts/generate-build-manifest.ts",
      "lastRunExitCode": null,
      "lastRunNotes": "",
      "notes": ""
    },
    "start": {
      "command": "bun run start",
      "verified": true,
      "source": "package.json scripts.start",
      "expandsTo": "NODE_ENV=production bun .next/standalone/server.js 2>&1 | tee server.log",
      "lastRunExitCode": null,
      "lastRunNotes": "",
      "notes": ""
    },
    "db:migrate": {
      "command": "bun run db:migrate",
      "verified": true,
      "source": "package.json scripts.db:migrate",
      "expandsTo": "prisma migrate dev",
      "lastRunExitCode": null,
      "lastRunNotes": "",
      "notes": ""
    },
    "db:reset": {
      "command": "bun run db:reset",
      "verified": true,
      "source": "package.json scripts.db:reset",
      "expandsTo": "prisma migrate reset",
      "lastRunExitCode": null,
      "lastRunNotes": "",
      "notes": ""
    },
    "check:frontier-maturity": {
      "command": "bun run check:frontier-maturity",
      "verified": true,
      "source": "package.json scripts.check:frontier-maturity",
      "expandsTo": "bun run src/engine/frontier/maturity-conformance.ts",
      "lastRunExitCode": null,
      "lastRunNotes": "",
      "notes": ""
    },
    "game:conformance": {
      "command": "bun run game:conformance",
      "verified": true,
      "source": "package.json scripts.game:conformance",
      "expandsTo": "bun run src/engine/game/conformance/game-conformance.ts",
      "lastRunExitCode": null,
      "lastRunNotes": "",
      "notes": ""
    },
    "game:dev": {
      "command": "bun run game:dev",
      "verified": true,
      "source": "package.json scripts.game:dev",
      "expandsTo": "bun run scripts/game-dev.ts",
      "lastRunExitCode": null,
      "lastRunNotes": "",
      "notes": ""
    },
    "game:village-conformance": {
      "command": "bun run game:village-conformance",
      "verified": true,
      "source": "package.json scripts.game:village-conformance",
      "expandsTo": "bun run src/engine/game/conformance/village-conformance.ts",
      "lastRunExitCode": null,
      "lastRunNotes": "",
      "notes": ""
    },
    "game:villagers-conformance": {
      "command": "bun run game:villagers-conformance",
      "verified": true,
      "source": "package.json scripts.game:villagers-conformance",
      "expandsTo": "bun run src/engine/game/conformance/villagers-conformance.ts",
      "lastRunExitCode": null,
      "lastRunNotes": "",
      "notes": ""
    }
  },
  "entrypoints": [
    {
      "id": "studio-web",
      "path": "src/app",
      "kind": "nextjs-app",
      "description": "Next.js 16 App Router root. Only route visible to the user is / (src/app/page.tsx). Editor at /editor (src/app/editor/page.tsx)."
    },
    {
      "id": "editor-ui",
      "path": "src/components/editor",
      "kind": "react-ui",
      "description": "Editor shell: viewport, panels, toolbar. React Three Fiber for 3D, shadcn/ui for chrome, Zustand for transient state."
    },
    {
      "id": "engine",
      "path": "src/engine",
      "kind": "engine-runtime",
      "description": "TypeScript engine kernel + plugin SDK + architect control plane + studio + frontier + production modules."
    },
    {
      "id": "api",
      "path": "src/app/api",
      "kind": "nextjs-api-routes",
      "description": "Next.js Route Handlers. 50+ endpoints under /api/architect, /api/editor, /api/frontier, /api/world, /api/studio, /api/engine, /api/fiberlab, /api/studio-ui."
    },
    {
      "id": "determinism-stack",
      "path": "src/lib/determinism",
      "kind": "library",
      "description": "Deterministic RNG, hashing, serialization, fixed-point, transcendentals. Proven with cross-browser hash parity."
    }
  ],
  "authoritativeSystems": {
    "world": {
      "status": "partial",
      "reason": "src/engine/world/world-fabric.ts and src/engine/frontier/world-asset-store.ts both touch world state. Canonical ownership not fully resolved. The studio/transactions.ts module provides the transaction path.",
      "candidatePaths": [
        "src/engine/world/world-fabric.ts",